pmid,title,year,journal,doi,abstract
33587235,Altered expression of lncRNAs in autism spectrum disorder.,2021,Metab Brain Dis,10.1007/s11011-021-00681-z,"Long non-coding RNAs (lncRNAs) have been recognized as an important epigenetic factor in the evolution of neuropsychiatric conditions. We have selected five lncRNAs (DISC2, PRKAR2A-AS1, LOC105375675, LRRC2-AS1, and LOC101928237) to measure their expression in blood samples of children with autism spectrum disorder (ASD) versus children with normal development. Expressions of DISC2, PRKAR2A-AS1 and LOC101928237 have been enhanced in ASD cases compared with healthy children (Posterior Beta = 2.508, P value<0.0001; Posterior Beta = 2.793, P value = 0.014 and Posterior Beta = 1.646, P value <0.0001, respectively). On the other hand, expression of LRRC2-AS1 has been lower in ASD patients compared with controls (Posterior Beta = -3.781, P value<0.0001). Remarkably, expression of DISC2 and PRKAR2A-AS1 have been lower in girls compared with boys (Posterior Beta = -0.982, P value<0.0001 and Posterior Beta = -0.135, P value<0.0001, respectively). In addition, expression of DISC2 has been lower in ASD cases aged more than 6 compared with those aged less than 6 years (Posterior Beta = -0.876, P value = 0.003). DISC2, LOC101928237, LRRC2-AS1, and PRKAR2A-AS1 had the area under curve (AUC) values of 0.76, 0.90, 0.92, and 0.79 in distinguishing between ASD and healthy children. Expression levels of none of DISC2, LOC101928237, LOC105375675, LRRC2-AS1, and PRKAR2A-AS1 were correlated with age of ASD cases or healthy controls. A significant correlation was detected between expressions of DISC2 and PRKAR2A-AS1. There were inverse correlations between the following pairs of lncRNAs: DISC2/LRRC2-AS1, DISC2/LOC101928237, LRRC2-AS1/PRKAR2A-AS1, LOC101928237/LRRC2-AS1, and LOC101928237 /LOC105375675. We conclude that DISC2, LOC101928237, LRRC2-AS1, and PRKAR2A-AS1 might be used as potential markers for this condition."
34535545,A survey of RNA editing at single-cell resolution links interneurons to schizophrenia and autism.,2021,RNA,10.1261/rna.078804.121,"Conversion of adenosine to inosine in RNA by ADAR enzymes, termed ""RNA editing,"" is essential for healthy brain development. Editing is dysregulated in neuropsychiatric diseases, but has not yet been investigated at scale at the level of individual neurons. We quantified RNA editing sites in nuclear transcriptomes of 3055 neurons from six cortical regions of a neurotypical female donor, and found 41,930 sites present in at least ten nuclei. Most sites were located within Alu repeats in introns or 3' UTRs, and approximately 80% were cataloged in public RNA editing databases. We identified 9285 putative novel editing sites, 29% of which were also detectable in unrelated donors. Intersection with results from bulk RNA-seq studies provided cell-type and spatial context for 1730 sites that are differentially edited in schizophrenic brain donors, and 910 such sites in autistic donors. Autism-related genes were also enriched with editing sites predicted to modify RNA structure. Inhibitory neurons showed higher overall transcriptome editing than excitatory neurons, and the highest editing rates were observed in the frontal cortex. We used generalized linear models to identify differentially edited sites and genes between cell types. Twenty nine genes were preferentially edited in excitatory neurons, and 43 genes were edited more heavily in inhibitory neurons, including "
34946850,Gene Regulation Analysis Reveals Perturbations of Autism Spectrum Disorder during Neural System Development.,2021,Genes (Basel),10.3390/genes12121901,"Autism spectrum disorder (ASD) is a neurodevelopmental disorder that impedes patients' cognition, social, speech and communication skills. ASD is highly heterogeneous with a variety of etiologies and clinical manifestations. The prevalence rate of ASD increased steadily in recent years. Presently, molecular mechanisms underlying ASD occurrence and development remain to be elucidated. Here, we integrated multi-layer genomics data to investigate the transcriptome and pathway dysregulations in ASD development. The RNA sequencing (RNA-seq) expression profiles of induced pluripotent stem cells (iPSCs), neural progenitor cells (NPCs) and neuron cells from ASD and normal samples were compared in our study. We found that substantially more genes were differentially expressed in the NPCs than the iPSCs. Consistently, gene set variation analysis revealed that the activity of the known ASD pathways in NPCs and neural cells were significantly different from the iPSCs, suggesting that ASD occurred at the early stage of neural system development. We further constructed comprehensive brain- and neural-specific regulatory networks by incorporating transcription factor (TF) and gene interactions with long 5 non-coding RNA(lncRNA) and protein interactions. We then overlaid the transcriptomes of different cell types on the regulatory networks to infer the regulatory cascades. The variations of the regulatory cascades between ASD and normal samples uncovered a set of novel disease-associated genes and gene interactions, particularly highlighting the functional roles of "
35710789,SFARI genes and where to find them; modelling Autism Spectrum Disorder specific gene expression dysregulation with RNA-seq data.,2022,Sci Rep,10.1038/s41598-022-14077-1,"Autism Spectrum Disorders (ASD) have a strong, yet heterogeneous, genetic component. Among the various methods that are being developed to help reveal the underlying molecular aetiology of the disease one approach that is gaining popularity is the combination of gene expression and clinical genetic data, often using the SFARI-gene database, which comprises lists of curated genes considered to have causative roles in ASD when mutated in patients. We build a gene co-expression network to study the relationship between ASD-specific transcriptomic data and SFARI genes and then analyse it at different levels of granularity. No significant evidence is found of association between SFARI genes and differential gene expression patterns when comparing ASD samples to a control group, nor statistical enrichment of SFARI genes in gene co-expression network modules that have a strong correlation with ASD diagnosis. However, classification models that incorporate topological information from the whole ASD-specific gene co-expression network can predict novel SFARI candidate genes that share features of existing SFARI genes and have support for roles in ASD in the literature. A statistically significant association is also found between the absolute level of gene expression and SFARI's genes and Scores, which can confound the analysis if uncorrected. We propose a novel approach to correct for this that is general enough to be applied to other problems affected by continuous sources of bias. It was found that only co-expression network analyses that integrate information from the whole network are able to reveal signatures linked to ASD diagnosis and novel candidate genes for the study of ASD, which individual gene or module analyses fail to do. It was also found that the influence of SFARI genes permeates not only other ASD scoring systems, but also lists of genes believed to be involved in other neurodevelopmental disorders."
35962193,Trans-genetic effects of circular RNA expression quantitative trait loci and potential causal mechanisms in autism.,2022,Mol Psychiatry,10.1038/s41380-022-01714-4,"Genetic risk variants and transcriptional expression changes in autism spectrum disorder (ASD) were widely investigated, but their causal relationship remains largely unknown. Circular RNAs (circRNAs) are abundant in brain and often serve as upstream regulators of mRNAs. By integrating RNA-sequencing with genotype data from autistic brains, we assessed expression quantitative trait loci of circRNAs (circQTLs) that cis-regulated expression of nearby circRNAs and trans-regulated expression of distant genes (trans-eGenes) simultaneously. We thus identified 3619 circQTLs that were also trans-eQTLs and constructed 19,804 circQTL-circRNA-trans-eGene regulatory axes. We conducted two different types of approaches, mediation and partial correlation tests (MPT), to determine the axes with mediation effects of circQTLs on trans-eGene expression through circRNA expression. We showed that the mediation effects of the circQTLs (trans-eQTLs) on circRNA expression were positively correlated with the magnitude of circRNA-trans-eGene correlation of expression profile. The positive correlation became more significant after adjustment for the circQTLs. Of the 19,804 axes, 8103 passed MPT. Meanwhile, we performed causal inference test (CIT) and identified 2070 circQTL-trans-eGene-ASD diagnosis propagation paths. We showed that the CIT-passing genes were significantly enriched for ASD risk genes, genes encoding postsynaptic density proteins, and other ASD-relevant genes, supporting the relevance of the CIT-passing genes to ASD pathophysiology. Integration of MPT- and CIT-passing axes further constructed 352 circQTL-circRNA-trans-eGene-ASD diagnosis propagation paths, wherein the circRNA-trans-eGene axes may act as causal mediators for the circQTL-ASD diagnosis associations. These analyses were also successfully applied to an independent dataset from schizophrenia brains. Collectively, this study provided the first framework for systematically investigating trans-genetic effects of circQTLs and inferring the corresponding causal relations in diseases. The identified circQTL-circRNA-trans-eGene regulatory interactions, particularly the internal modules that were previously implicated in the examined disorders, also provided a helpful dataset for further investigating causative biology and cryptic regulatory mechanisms underlying the neuropsychiatric diseases."
36213201,Cell-type specific transcriptomic signatures of neocortical circuit organization and their relevance to autism.,2022,Front Neural Circuits,10.3389/fncir.2022.982721,"A prevailing challenge in neuroscience is understanding how diverse neuronal cell types select their synaptic partners to form circuits. In the neocortex, major classes of excitatory projection neurons and inhibitory interneurons are conserved across functionally distinct regions. There is evidence these classes form canonical circuit motifs that depend primarily on their identity; however, regional cues likely also influence their choice of synaptic partners. We mined the Allen Institute's single-cell RNA-sequencing database of mouse cortical neurons to study the expression of genes necessary for synaptic connectivity and physiology in two regions: the anterior lateral motor cortex (ALM) and the primary visual cortex (VISp). We used the Allen's metadata to parse cells by clusters representing major excitatory and inhibitory classes that are common to both ALM and VISp. We then performed two types of pairwise differential gene expression analysis: (1) between different neuronal classes within the same brain region (ALM or VISp), and (2) between the same neuronal class in ALM and VISp. We filtered our results for differentially expressed genes related to circuit connectivity and developed a novel bioinformatic approach to determine the sets uniquely enriched in each neuronal class in ALM, VISp, or both. This analysis provides an organized set of genes that may regulate synaptic connectivity and physiology in a cell-type-specific manner. Furthermore, it identifies candidate mechanisms for circuit organization that are conserved across functionally distinct cortical regions or that are region dependent. Finally, we used the SFARI Human Gene Module to identify genes from this analysis that are related to risk for autism spectrum disorder (ASD). Our analysis provides clear molecular targets for future studies to understand neocortical circuit organization and abnormalities that underlie autistic phenotypes."
36323788,Broad transcriptomic dysregulation occurs across the cerebral cortex in ASD.,2022,Nature,10.1038/s41586-022-05377-7,"Neuropsychiatric disorders classically lack defining brain pathologies, but recent work has demonstrated dysregulation at the molecular level, characterized by transcriptomic and epigenetic alterations"
36590292,Common targetable inflammatory pathways in brain transcriptome of autism spectrum disorders and Tourette syndrome.,2022,Front Neurosci,10.3389/fnins.2022.999346,"Neurodevelopmental disorders (NDDs), including autism-spectrum disorders (ASD) and Tourette syndrome (TS) are common brain conditions which often co-exist, and have no approved treatments targeting disease mechanisms. Accumulating literature implicates the immune system in NDDs, and transcriptomics of post-mortem brain tissue has revealed an inflammatory signal. We interrogated two RNA-sequencing datasets of ASD and TS and identified differentially expressed genes, to explore commonly enriched pathways through GO, KEGG, and Reactome. The DEGs [False Discovery Rate ("
36688057,The Issue of Monocyte Activation in ASD: Troubles with Translation.,2022,J Cell Immunol,10.33696/immunology.4.146,"Autism spectrum disorder (ASD) prevalence has increased year on year for the past two decades and currently affects 1 in 44 individuals in the US. An increasing number of studies have pointed to increased immune activation as both an etiological agent and also involved in the ongoing pathological process of ASD. Both adaptive and innate immune responses have been implicated. Evidence of innate dysregulation has so far included increased production of innate inflammatory cytokines, increased cell numbers, and altered activation in monocytes in the blood and microglia in the brain. Suggesting an orchestrated innate immune response may be involved in ASD. Hughes et al. (2022) recently assessed transcriptome differences that could underlie altered activation of monocytes using next-generation bulk-RNA sequencing on isolated CD14+ monocytes at baseline and after activation with different Toll-like receptor agonists. Circulating CD14+ monocyte from children with autistic disorder (AD) and children diagnosed with perverse developmental disorder not otherwise specified (PDD-NOS) were found to differ in a number of activation pathways after gene enrichment analysis compared to typically developing children. There was an overall upregulation in translational machinery in both neurodevelopmental disorder groups, whereas typically developing children were downregulated, indicating an issue with monocyte activation. Several identified differentially expressed genes in monocytes were also identified as ASD at-risk genes, according to the Simons Foundation Autism Research Initiative (SFARI), and genes involved in inflammatory bowel diseases. This work implicates altered monocyte activation with a lack of regulation as a potential mechanistic issue in ASD. Future work is warranted to evaluate how monocyte regulatory mechanisms differ in ASD individuals."
36862688,Neuron-specific transcriptomic signatures indicate neuroinflammation and altered neuronal activity in ASD temporal cortex.,2023,Proc Natl Acad Sci U S A,10.1073/pnas.2206758120,"Autism spectrum disorder (ASD) is a highly heterogeneous disorder, yet transcriptomic profiling of bulk brain tissue has identified substantial convergence among dysregulated genes and pathways in ASD. However, this approach lacks cell-specific resolution. We performed comprehensive transcriptomic analyses on bulk tissue and laser-capture microdissected (LCM) neurons from 59 postmortem human brains (27 ASD and 32 controls) in the superior temporal gyrus (STG) of individuals ranging from 2 to 73 years of age. In bulk tissue, synaptic signaling, heat shock protein-related pathways, and RNA splicing were significantly altered in ASD. There was age-dependent dysregulation of genes involved in gamma aminobutyric acid (GABA) ("
37041460,Single-nucleus gene and gene set expression-based similarity network fusion identifies autism molecular subtypes.,2023,BMC Bioinformatics,10.1186/s12859-023-05278-0,"BACKGROUND: Autism spectrum disorder (ASD) is a complex neurodevelopmental disorder that is highly phenotypically and genetically heterogeneous. With the accumulation of biological sequencing data, more and more studies shift to molecular subtype-first approach, from identifying molecular subtypes based on genetic and molecular data to linking molecular subtypes with clinical manifestation, which can reduce heterogeneity before phenotypic profiling.
RESULTS: In this study, we perform similarity network fusion to integrate gene and gene set expression data of multiple human brain cell types for ASD molecular subtype identification. Then we apply subtype-specific differential gene and gene set expression analyses to study expression patterns specific to molecular subtypes in each cell type. To demonstrate the biological and practical significance, we analyze the molecular subtypes, investigate their correlation with ASD clinical phenotype, and construct ASD molecular subtype prediction models.
CONCLUSIONS: The identified molecular subtype-specific gene and gene set expression may be used to differentiate ASD molecular subtypes, facilitating the diagnosis and treatment of ASD. Our method provides an analytical pipeline for the identification of molecular subtypes and even disease subtypes of complex disorders."
37381037,Exploratory analysis of L1 retrotransposons expression in autism﻿.,2023,Mol Autism,10.1186/s13229-023-00554-5,"BACKGROUND: Autism spectrum disorder (ASD) is a set of highly heterogeneous neurodevelopmental diseases whose genetic etiology is not completely understood. Several investigations have relied on transcriptome analysis from peripheral tissues to dissect ASD into homogenous molecular phenotypes. Recently, analysis of changes in gene expression from postmortem brain tissues has identified sets of genes that are involved in pathways previously associated with ASD etiology. In addition to protein-coding transcripts, the human transcriptome is composed by a large set of non-coding RNAs and transposable elements (TEs). Advancements in sequencing technologies have proven that TEs can be transcribed in a regulated fashion, and their dysregulation might have a role in brain diseases.
METHODS: We exploited published datasets comprising RNA-seq data from (1) postmortem brain of ASD subjects, (2) in vitro cell cultures where ten different ASD-relevant genes were knocked out and (3) blood of discordant siblings. We measured the expression levels of evolutionarily young full-length transposable L1 elements and characterized the genomic location of deregulated L1s assessing their potential impact on the transcription of ASD-relevant genes. We analyzed every sample independently, avoiding to pool together the disease subjects to unmask the heterogeneity of the molecular phenotypes.
RESULTS: We detected a strong upregulation of intronic full-length L1s in a subset of postmortem brain samples and in in vitro differentiated neurons from iPSC knocked out for ATRX. L1 upregulation correlated with an high number of deregulated genes and retained introns. In the anterior cingulate cortex of one subject, a small number of significantly upregulated L1s overlapped with ASD-relevant genes that were significantly downregulated, suggesting the possible existence of a negative effect of L1 transcription on host transcripts.
LIMITATIONS: Our analyses must be considered exploratory and will need to be validated in bigger cohorts. The main limitation is given by the small sample size and by the lack of replicates for postmortem brain samples. Measuring the transcription of locus-specific TEs is complicated by the repetitive nature of their sequence, which reduces the accuracy in mapping sequencing reads to the correct genomic locus.
CONCLUSIONS: L1 upregulation in ASD appears to be limited to a subset of subjects that are also characterized by a general deregulation of the expression of canonical genes and an increase in intron retention. In some samples from the anterior cingulate cortex, L1s upregulation seems to directly impair the expression of some ASD-relevant genes by a still unknown mechanism. L1s upregulation may therefore identify a group of ASD subjects with common molecular features and helps stratifying individuals for novel strategies of therapeutic intervention."
37704762,Single-cell brain organoid screening identifies developmental defects in autism.,2023,Nature,10.1038/s41586-023-06473-y,The development of the human brain involves unique processes (not observed in many other species) that can contribute to neurodevelopmental disorders
37807181,Dissection of cellular disruptions in autism spectrum disorder comorbidities.,2023,Eur J Neurosci,10.1111/ejn.16155,"Up to 80% of children with autism spectrum disorder have at least one other neuropsychiatric comorbidity. The causes of such disorders are highly genetic, yet many studies fail to take analysis further than risk gene discovery to see cellular and mechanistic changes occurring. Therefore, the goal of this study was to unveil novel gene expression signatures involved in important neurodevelopmental processes that, when disrupted, lead to each of the autism comorbidities of interest. We achieved this by analysing a single-nuclei RNA sequencing dataset with prefrontal cortex samples from autism spectrum disorder plus comorbidities for differentially expressed genes. The highest number of alterations was seen in excitatory neurons, which also showed differential population and cell-cell interactions across disorders and an increase in expression of genes involved in neurodevelopmental pathways. Interestingly, the group without comorbidities displayed an increase in neuron-neuron interactions yet a decrease in population number, suggesting a major rewiring of neuronal connections. Further analysis of the topmost significant genes from this cell type in developing prefrontal cortex datasets revealed interesting expression trajectories corresponding to important time points during corticogenesis. This further identified four novel candidate genes that show a potential link to developmental pathways that may contribute to autism and its comorbidities when dysregulated. The study provides a better understanding of co-occurring conditions at a transcriptomic and cell-type level and thereby aid future research in providing earlier diagnosis, care and intervention."
