pmid,title,year,journal,doi,abstract
20868653,Gene and miRNA expression profiles in autism spectrum disorders.,2011,Brain Res,10.1016/j.brainres.2010.09.046,"Accumulating data indicate that there is significant genetic heterogeneity underlying the etiology in individuals diagnosed with autism spectrum disorder (ASD). Some rare and highly-penetrant gene variants and copy number variation (CNV) regions including NLGN3, NLGN4, NRXN1, SHANK2, SHANK3, PTCHD1, 1q21.1, maternally-inherited duplication of 15q11-q13, 16p11.2, amongst others, have been identified to be involved in ASD. Genome-wide association studies have identified other apparently low risk loci and in some other cases, ASD arises as a co-morbid phenotype with other medical genetic conditions (e.g. fragile X). The progress studying the genetics of ASD has largely been accomplished using genomic analyses of germline-derived DNA. Here, we used gene and miRNA expression profiling using cell-line derived total RNA to evaluate possible transcripts and networks of molecules involved in ASD. Our analysis identified several novel dysregulated genes and miRNAs in ASD compared with controls, including HEY1, SOX9, miR-486 and miR-181b. All of these are involved in nervous system development and function and some others, for example, are involved in NOTCH signaling networks (e.g. HEY1). Further, we found significant enrichment in molecules associated with neurological disorders such as Rett syndrome and those associated with nervous system development and function including long-term potentiation. Our data will provide a valuable resource for discovery purposes and for comparison to other gene expression-based, genome-wide DNA studies and other functional data."
26186191,FOXG1-Dependent Dysregulation of GABA/Glutamate Neuron Differentiation in Autism Spectrum Disorders.,2015,Cell,10.1016/j.cell.2015.06.034,"Autism spectrum disorder (ASD) is a disorder of brain development. Most cases lack a clear etiology or genetic basis, and the difficulty of re-enacting human brain development has precluded understanding of ASD pathophysiology. Here we use three-dimensional neural cultures (organoids) derived from induced pluripotent stem cells (iPSCs) to investigate neurodevelopmental alterations in individuals with severe idiopathic ASD. While no known underlying genomic mutation could be identified, transcriptome and gene network analyses revealed upregulation of genes involved in cell proliferation, neuronal differentiation, and synaptic assembly. ASD-derived organoids exhibit an accelerated cell cycle and overproduction of GABAergic inhibitory neurons. Using RNA interference, we show that overexpression of the transcription factor FOXG1 is responsible for the overproduction of GABAergic neurons. Altered expression of gene network modules and FOXG1 are positively correlated with symptom severity. Our data suggest that a shift toward GABAergic neuron fate caused by FOXG1 is a developmental precursor of ASD."
26687839,Cytoplasmic Rbfox1 Regulates the Expression of Synaptic and Autism-Related Genes.,2016,Neuron,10.1016/j.neuron.2015.11.025,"Human genetic studies have identified the neuronal RNA binding protein, Rbfox1, as a candidate gene for autism spectrum disorders. While Rbfox1 functions as a splicing regulator in the nucleus, it is also alternatively spliced to produce cytoplasmic isoforms. To investigate the function of cytoplasmic Rbfox1, we knocked down Rbfox proteins in mouse neurons and rescued with cytoplasmic or nuclear Rbfox1. Transcriptome profiling showed that nuclear Rbfox1 rescued splicing changes, whereas cytoplasmic Rbfox1 rescued changes in mRNA levels. iCLIP-seq of subcellular fractions revealed that Rbfox1 bound predominantly to introns in nascent RNA, while cytoplasmic Rbox1 bound to 3' UTRs. Cytoplasmic Rbfox1 binding increased target mRNA stability and translation, and Rbfox1 and miRNA binding sites overlapped significantly. Cytoplasmic Rbfox1 target mRNAs were enriched in genes involved in cortical development and autism. Our results uncover a new Rbfox1 regulatory network and highlight the importance of cytoplasmic RNA metabolism to cortical development and disease."
27131873,Exploiting aberrant mRNA expression in autism for gene discovery and diagnosis.,2016,Hum Genet,10.1007/s00439-016-1673-7,"Autism spectrum disorder (ASD) is characterized by substantial phenotypic and genetic heterogeneity, which greatly complicates the identification of genetic factors that contribute to the disease. Study designs have mainly focused on group differences between cases and controls. The problem is that, by their nature, group difference-based methods (e.g., differential expression analysis) blur or collapse the heterogeneity within groups. By ignoring genes with variable within-group expression, an important axis of genetic heterogeneity contributing to expression variability among affected individuals has been overlooked. To this end, we develop a new gene expression analysis method-aberrant gene expression analysis, based on the multivariate distance commonly used for outlier detection. Our method detects the discrepancies in gene expression dispersion between groups and identifies genes with significantly different expression variability. Using this new method, we re-visited RNA sequencing data generated from post-mortem brain tissues of 47 ASD and 57 control samples. We identified 54 functional gene sets whose expression dispersion in ASD samples is more pronounced than that in controls, as well as 76 co-expression modules present in controls but absent in ASD samples due to ASD-specific aberrant gene expression. We also exploited aberrantly expressed genes as biomarkers for ASD diagnosis. With a whole blood expression data set, we identified three aberrantly expressed gene sets whose expression levels serve as discriminating variables achieving >70 % classification accuracy. In summary, our method represents a novel discovery and diagnostic strategy for ASD. Our findings may help open an expression variability-centered research avenue for other genetically heterogeneous disorders."
27439572,SLC9A9 Co-expression modules in autism-associated brain regions.,2017,Autism Res,10.1002/aur.1670,"SLC9A9 is a sodium hydrogen exchanger present in the recycling endosome and highly expressed in the brain. It is implicated in neuropsychiatric disorders, including autism spectrum disorders (ASDs). Little research concerning its gene expression patterns and biological pathways has been conducted. We sought to investigate its possible biological roles in autism-associated brain regions throughout development. We conducted a weighted gene co-expression network analysis on RNA-seq data downloaded from Brainspan. We compared prenatal and postnatal gene expression networks for three ASD-associated brain regions known to have high SLC9A9 gene expression. We also performed an ASD-associated single nucleotide polymorphism enrichment analysis and a cell signature enrichment analysis. The modules showed differences in gene constituents (membership), gene number, and connectivity throughout time. SLC9A9 was highly associated with immune system functions, metabolism, apoptosis, endocytosis, and signaling cascades. Gene list comparison with co-immunoprecipitation data was significant for multiple modules. We found a disproportionately high autism risk signal among genes constituting the prenatal hippocampal module. The modules were enriched with astrocyte and oligodendrocyte markers. SLC9A9 is potentially involved in the pathophysiology of ASDs. Our investigation confirmed proposed functions for SLC9A9, such as endocytosis and immune regulation, while also revealing potential roles in mTOR signaling and cell survival.. By providing a concise molecular map and interactions, evidence of cell type and implicated brain regions we hope this will guide future research on SLC9A9. Autism Res 2017, 10: 414-429. © 2016 International Society for Autism Research, Wiley Periodicals, Inc."
28184278,Possible sexually dimorphic role of miRNA and other sncRNA in ASD brain.,2017,Mol Autism,10.1186/s13229-017-0117-0,"BACKGROUND: Autism spectrum disorder (ASD) is sexually dimorphic in brain structure, genetics, and behaviors. In studies of brain tissue, the age of the population is clearly a factor in interpreting study outcome, yet sex is rarely considered. To begin to address this issue, we extend our previously published microarray analyses to examine expression of small noncoding RNAs (sncRNAs), including microRNAs (miRNAs), in ASD and in the control temporal cortex in males and females. Predicted miRNA targets were identified as well as the pathways they overpopulate.
FINDINGS: After considering age, sexual dimorphism in ASD sncRNA expression persists in the temporal cortex and in the patterning that distinguishes regions. Among the sexually dimorphic miRNAs are miR-219 and miR-338, which promote oligodendrocyte differentiation, miR-125, implicated in neuronal differentiation, and miR-488, implicated in anxiety. Putative miRNA targets are significantly over-represented in immune and nervous system pathways in both sexes, consistent with previous mRNA studies. Even for common pathways, the specific target mRNAs are often sexually dimorphic. For example, both male and female target genes significantly populate the Axonal Guidance Signaling pathway, yet less than a third of the targets are common to both sexes.
CONCLUSIONS: Our findings of sexual dimorphism in sncRNA levels underscore the importance of considering sex, in addition to age, when interpreting molecular findings on ASD brain."
30111840,Autism-like phenotype and risk gene mRNA deadenylation by CPEB4 mis-splicing.,2018,Nature,10.1038/s41586-018-0423-5,"Common genetic contributions to autism spectrum disorder (ASD) reside in risk gene variants that individually have minimal effect sizes. As environmental factors that perturb neurodevelopment also underlie idiopathic ASD, it is crucial to identify altered regulators that can orchestrate multiple ASD risk genes during neurodevelopment. Cytoplasmic polyadenylation element binding proteins 1-4 (CPEB1-4) regulate the translation of specific mRNAs by modulating their poly(A)-tails and thereby participate in embryonic development and synaptic plasticity. Here we find that CPEB4 binds transcripts of most high-confidence ASD risk genes. The brains of individuals with idiopathic ASD show imbalances in CPEB4 transcript isoforms that result from decreased inclusion of a neuron-specific microexon. In addition, 9% of the transcriptome shows reduced poly(A)-tail length. Notably, this percentage is much higher for high-confidence ASD risk genes, correlating with reduced expression of the protein products of ASD risk genes. An equivalent imbalance in CPEB4 transcript isoforms in mice mimics the changes in mRNA polyadenylation and protein expression of ASD risk genes and induces ASD-like neuroanatomical, electrophysiological and behavioural phenotypes. Together, these data identify CPEB4 as a regulator of ASD risk genes."
30545856,"Transcriptome-wide isoform-level dysregulation in ASD, schizophrenia, and bipolar disorder.",2018,Science,10.1126/science.aat8127,"Most genetic risk for psychiatric disease lies in regulatory regions, implicating pathogenic dysregulation of gene expression and splicing. However, comprehensive assessments of transcriptomic organization in diseased brains are limited. In this work, we integrated genotypes and RNA sequencing in brain samples from 1695 individuals with autism spectrum disorder (ASD), schizophrenia, and bipolar disorder, as well as controls. More than 25% of the transcriptome exhibits differential splicing or expression, with isoform-level changes capturing the largest disease effects and genetic enrichments. Coexpression networks isolate disease-specific neuronal alterations, as well as microglial, astrocyte, and interferon-response modules defining previously unidentified neural-immune mechanisms. We integrated genetic and genomic data to perform a transcriptome-wide association study, prioritizing disease loci likely mediated by cis effects on brain expression. This transcriptome-wide characterization of the molecular pathology across three major psychiatric disorders provides a comprehensive resource for mechanistic insight and therapeutic development."
30547845,Co-expression of long non-coding RNAs and autism risk genes in the developing human brain.,2018,BMC Syst Biol,10.1186/s12918-018-0639-x,"BACKGROUND: Autism Spectrum Disorder (ASD) is the umbrella term for a group of neurodevelopmental disorders convergent on behavioral phenotypes. While many genes have been implicated in the disorder, the predominant focus of previous research has been on protein coding genes. This leaves a vast number of long non-coding RNAs (lncRNAs) not characterized for their role in the disorder although lncRNAs have been shown to play important roles in development and are highly represented in the brain. Studies have also shown lncRNAs to be differentially expressed in ASD affected brains. However, there has yet to be an enrichment analysis of the shared ontologies and pathways of known ASD genes and lncRNAs in normal brain development.
RESULTS: In this study, we performed co-expression network analysis on the developing brain transcriptome to identify potential lncRNAs associated with ASD and possible annotations for functional role of lncRNAs in brain development. We found co-enrichment of lncRNA genes and ASD risk genes in two distinct groups of modules showing elevated prenatal and postnatal expression patterns, respectively. Further enrichment analysis of the module groups indicated that the early expression modules were comprised mainly of transcriptional regulators while the later expression modules were associated with synapse formation. Finally, lncRNAs were prioritized for their connectivity with the known ASD risk genes through analysis of an adjacency matrix. Collectively, the results imply early developmental repression of synaptic genes through lncRNAs and ASD transcriptional regulators.
CONCLUSION: Here we demonstrate the utility of mining the publically available brain gene expression data to further functionally annotate the role of lncRNAs in ASD. Our analysis indicates that lncRNAs potentially have a key role in ASD due to their convergence on shared pathways, and we identify lncRNAs of interest that may lead to further avenues of study."
31097668,Single-cell genomics identifies cell type-specific molecular changes in autism.,2019,Science,10.1126/science.aav8130,"Despite the clinical and genetic heterogeneity of autism, bulk gene expression studies show that changes in the neocortex of autism patients converge on common genes and pathways. However, direct assessment of specific cell types in the brain affected by autism has not been feasible until recently. We used single-nucleus RNA sequencing of cortical tissue from patients with autism to identify autism-associated transcriptomic changes in specific cell types. We found that synaptic signaling of upper-layer excitatory neurons and the molecular state of microglia are preferentially affected in autism. Moreover, our results show that dysregulation of specific groups of genes in cortico-cortical projection neurons correlates with clinical severity of autism. These findings suggest that molecular changes in upper-layer cortical circuits are linked to behavioral manifestations of autism."
31500805,"Synaptic and Gene Regulatory Mechanisms in Schizophrenia, Autism, and 22q11.2 Copy Number Variant-Mediated Risk for Neuropsychiatric Disorders.",2020,Biol Psychiatry,10.1016/j.biopsych.2019.06.029,"BACKGROUND: 22q11.2 copy number variants are among the most highly penetrant genetic risk variants for developmental neuropsychiatric disorders such as schizophrenia (SCZ) and autism spectrum disorder (ASD). However, the specific mechanisms through which they confer risk remain unclear.
METHODS: Using a functional genomics approach, we integrated transcriptomic data from the developing human brain, genome-wide association findings for SCZ and ASD, protein interaction data, and gene expression signatures from SCZ and ASD postmortem cortex to 1) organize genes into the developmental cellular and molecular systems within which they operate, 2) identify neurodevelopmental processes associated with polygenic risk for SCZ and ASD across the allelic frequency spectrum, and 3) elucidate pathways and individual genes through which 22q11.2 copy number variants may confer risk for each disorder.
RESULTS: Polygenic risk for SCZ and ASD converged on partially overlapping neurodevelopmental modules involved in synaptic function and transcriptional regulation, with ASD risk variants additionally enriched for modules involved in neuronal differentiation during fetal development. The 22q11.2 locus formed a large protein network during development that disproportionately affected SCZ-associated and ASD-associated neurodevelopmental modules, including loading highly onto synaptic and gene regulatory pathways. SEPT5, PI4KA, and SNAP29 genes are candidate drivers of 22q11.2 synaptic pathology relevant to SCZ and ASD, and DGCR8 and HIRA are candidate drivers of disease-relevant alterations in gene regulation.
CONCLUSIONS: This approach offers a powerful framework to identify neurodevelopmental processes affected by diverse risk variants for SCZ and ASD and elucidate mechanisms through which highly penetrant, multigene copy number variants contribute to disease risk."
33080834,"Comprehensive Analysis of RNA-Seq Gene Expression Profiling of Brain Transcriptomes Reveals Novel Genes, Regulators, and Pathways in Autism Spectrum Disorder.",2020,Brain Sci,10.3390/brainsci10100747,"BACKGROUND: Autism spectrum disorder (ASD) is a neurodevelopmental disorder with deficits in social communication ability and repetitive behavior. The pathophysiological events involved in the brain of this complex disease are still unclear.
METHODS: In this study, we aimed to profile the gene expression signatures of brain cortex of ASD patients, by using two publicly available RNA-seq studies, in order to discover new ASD-related genes.
RESULTS: We detected 1567 differentially expressed genes (DEGs) by meta-analysis, where 1194 were upregulated and 373 were downregulated genes. Several ASD-related genes previously reported were also identified. Our meta-analysis identified 235 new DEGs that were not detected using the individual RNA-seq studies used. Some of those genes, including seven DEGs (
CONCLUSION: Novel core genes and molecular signatures involved with ASD were identified by our meta-analysis."
33157009,NCKAP1 Disruptive Variants Lead to a Neurodevelopmental Disorder with Core Features of Autism.,2020,Am J Hum Genet,10.1016/j.ajhg.2020.10.002,"NCKAP1/NAP1 regulates neuronal cytoskeletal dynamics and is essential for neuronal differentiation in the developing brain. Deleterious variants in NCKAP1 have been identified in individuals with autism spectrum disorder (ASD) and intellectual disability; however, its clinical significance remains unclear. To determine its significance, we assemble genotype and phenotype data for 21 affected individuals from 20 unrelated families with predicted deleterious variants in NCKAP1. This includes 16 individuals with de novo (n = 8), transmitted (n = 6), or inheritance unknown (n = 2) truncating variants, two individuals with structural variants, and three with potentially disruptive de novo missense variants. We report a de novo and ultra-rare deleterious variant burden of NCKAP1 in individuals with neurodevelopmental disorders which needs further replication. ASD or autistic features, language and motor delay, and variable expression of intellectual or learning disability are common clinical features. Among inherited cases, there is evidence of deleterious variants segregating with neuropsychiatric disorders. Based on available human brain transcriptomic data, we show that NCKAP1 is broadly and highly expressed in both prenatal and postnatal periods and demostrate enriched expression in excitatory neurons and radial glias but depleted expression in inhibitory neurons. Mouse in utero electroporation experiments reveal that Nckap1 loss of function promotes neuronal migration during early cortical development. Combined, these data support a role for disruptive NCKAP1 variants in neurodevelopmental delay/autism, possibly by interfering with neuronal migration early in cortical development."
33160303,Prediction and prioritization of autism-associated long non-coding RNAs using gene expression and sequence features.,2020,BMC Bioinformatics,10.1186/s12859-020-03843-5,"BACKGROUND: Autism spectrum disorders (ASD) refer to a range of neurodevelopmental conditions, which are genetically complex and heterogeneous with most of the genetic risk factors also found in the unaffected general population. Although all the currently known ASD risk genes code for proteins, long non-coding RNAs (lncRNAs) as essential regulators of gene expression have been implicated in ASD. Some lncRNAs show altered expression levels in autistic brains, but their roles in ASD pathogenesis are still unclear.
RESULTS: In this study, we have developed a new machine learning approach to predict candidate lncRNAs associated with ASD. Particularly, the knowledge learnt from protein-coding ASD risk genes was transferred to the prediction and prioritization of ASD-associated lncRNAs. Both developmental brain gene expression data and transcript sequence were found to contain relevant information for ASD risk gene prediction. During the pre-training phase of model construction, an autoencoder network was implemented for a representation learning of the gene expression data, and a random-forest-based feature selection was applied to the transcript-sequence-derived k-mers. Our models, including logistic regression, support vector machine and random forest, showed robust performance based on tenfold cross-validations as well as candidate prioritization with hypothetical loci. We then utilized the models to predict and prioritize a list of candidate lncRNAs, including some reported to be cis-regulators of known ASD risk genes, for further investigation.
CONCLUSIONS: Our results suggest that ASD risk genes can be accurately predicted using developmental brain gene expression data and transcript sequence features, and the models may provide useful information for functional characterization of the candidate lncRNAs associated with ASD."
33243861,In vivo Perturb-Seq reveals neuronal and glial abnormalities associated with autism risk genes.,2020,Science,10.1126/science.aaz6063,"The number of disease risk genes and loci identified through human genetic studies far outstrips the capacity to systematically study their functions. We applied a scalable genetic screening approach, in vivo Perturb-Seq, to functionally evaluate 35 autism spectrum disorder/neurodevelopmental delay (ASD/ND) de novo loss-of-function risk genes. Using CRISPR-Cas9, we introduced frameshift mutations in these risk genes in pools, within the developing mouse brain in utero, followed by single-cell RNA-sequencing of perturbed cells in the postnatal brain. We identified cell type-specific and evolutionarily conserved gene modules from both neuronal and glial cell classes. Recurrent gene modules and cell types are affected across this cohort of perturbations, representing key cellular effects across sets of ASD/ND risk genes. In vivo Perturb-Seq allows us to investigate how diverse mutations affect cell types and states in the developing organism."
33262327,"Autism-associated miR-873 regulates ARID1B, SHANK3 and NRXN2 involved in neurodevelopment.",2020,Transl Psychiatry,10.1038/s41398-020-01106-8,"Autism spectrum disorders (ASD) are highly heritable neurodevelopmental disorders with significant genetic heterogeneity. Noncoding microRNAs (miRNAs) are recognised as playing key roles in development of ASD albeit the function of these regulatory genes remains unclear. We previously conducted whole-exome sequencing of Australian families with ASD and identified four novel single nucleotide variations in mature miRNA sequences. A pull-down transcriptome analysis using transfected SH-SY5Y cells proposed a mechanistic model to examine changes in binding affinity associated with a unique mutation found in the conserved 'seed' region of miR-873-5p (rs777143952: T > A). Results suggested several ASD-risk genes were differentially targeted by wild-type and mutant miR-873 variants. In the current study, a dual-luciferase reporter assay confirmed miR-873 variants have a 20-30% inhibition/dysregulation effect on candidate autism risk genes ARID1B, SHANK3 and NRXN2 and also confirmed the affected expression with qPCR. In vitro mouse hippocampal neurons transfected with mutant miR-873 showed less morphological complexity and enhanced sodium currents and excitatory neurotransmission compared to cells transfected with wild-type miR-873. A second in vitro study showed CRISPR/Cas9 miR-873 disrupted SH-SY5Y neuroblastoma cells acquired a neuronal-like morphology and increased expression of ASD important genes ARID1B, SHANK3, ADNP2, ANK2 and CHD8. These results represent the first functional evidence that miR-873 regulates key neural genes involved in development and cell differentiation."
